{
  "schema_version": "packaging-asset-pack-run.v3",
  "contract_version": "whole_product_ocr_rotation_pack_v3",
  "run_id": "replace-with-run-id",
  "product_id": "replace-with-product-id",
  "product_state_id": "STATE_CLOSED_001",
  "stage": "SOURCE_INGESTED",
  "exact_copy_mode": "all_visible_product_native_copy",
  "allow_geometry_only_preview": false,
  "rotation_profile": "R16",
  "master_resolution_contract": {
    "aspect_ratio": "16:9",
    "minimum_native_width_px": 1280,
    "minimum_native_height_px": 720,
    "post_generation_resize_allowed_to_meet_minimum": false,
    "external_4k_is_separate_delivery_state": true
  },
  "product_features": [
    "embossing_or_debossing",
    "flat_or_rectangular_body",
    "high_material_risk",
    "liquid_or_gel",
    "non_symmetric_closure",
    "ordinary_label_heavy_packaging",
    "pump_or_spray",
    "transparent_or_translucent",
    "visible_dip_tube",
    "visible_fill_line_or_liquid_boundary"
  ],
  "paths": {
    "source_manifest": "00_source/source_manifest.json",
    "surface_inventory": "00_source/surface_inventory.json",
    "ocr_observations": "01_ocr/ocr_observations.json",
    "text_ssot": "01_ocr/exact_copy_text_ssot.json",
    "code_manifest": "01_ocr/code_manifest.json",
    "logo_graphic_manifest": "01_ocr/logo_graphic_manifest.json",
    "exact_copy_bundle": "01_ocr/exact_copy_bundle_manifest.json",
    "coverage_matrix": "02_coverage/coverage_matrix.json",
    "motion_envelope": "02_coverage/motion_envelope.json",
    "continuity_contract": "02_coverage/continuity_contract.json",
    "composition_plan": "03_composition/deterministic_composition_plan.json",
    "surface_texture_atlas": "03_composition/surface_texture_atlas.json",
    "protected_region_masks": "03_composition/protected_region_masks.json",
    "generation_prompt_index": "04_prompts/generation_prompt_index.json",
    "asset_qa": "07_qa/asset_qa.json",
    "continuity_qa": "07_qa/continuity_qa.json",
    "post_composite_verification": "07_qa/post_composite_verification.json"
  },
  "hashes": {
    "source_manifest_sha256": "0000000000000000000000000000000000000000000000000000000000000000",
    "surface_inventory_sha256": "0000000000000000000000000000000000000000000000000000000000000000",
    "ocr_observations_sha256": "0000000000000000000000000000000000000000000000000000000000000000",
    "text_ssot_sha256": "0000000000000000000000000000000000000000000000000000000000000000",
    "code_manifest_sha256": "0000000000000000000000000000000000000000000000000000000000000000",
    "logo_graphic_manifest_sha256": "0000000000000000000000000000000000000000000000000000000000000000",
    "exact_copy_bundle_sha256": "0000000000000000000000000000000000000000000000000000000000000000",
    "exact_copy_bundle_file_sha256": "0000000000000000000000000000000000000000000000000000000000000000",
    "coverage_matrix_sha256": "0000000000000000000000000000000000000000000000000000000000000000",
    "motion_envelope_sha256": "0000000000000000000000000000000000000000000000000000000000000000",
    "continuity_contract_sha256": "0000000000000000000000000000000000000000000000000000000000000000",
    "composition_plan_sha256": "0000000000000000000000000000000000000000000000000000000000000000",
    "surface_texture_atlas_sha256": "0000000000000000000000000000000000000000000000000000000000000000",
    "protected_region_masks_sha256": "0000000000000000000000000000000000000000000000000000000000000000",
    "generation_prompt_index_sha256": null,
    "asset_qa_sha256": null,
    "continuity_qa_sha256": null,
    "post_composite_verification_sha256": null
  },
  "gates": {
    "variant_conflict_status": "passed",
    "whole_product_ocr_status": "pending",
    "region_ocr_status": "pending",
    "copy_preflight_status": "blocked",
    "exact_copy_bundle_hash_verified": false,
    "unresolved_required_field_count": 1,
    "source_conflict_count": 0,
    "required_code_decodes_pass": false,
    "logo_graphic_binding_pass": false,
    "deterministic_composition_plan_status": "pending",
    "required_view_surface_coverage_status": "pending",
    "prompt_compilation_allowed": false,
    "image_generation_allowed": false
  },
  "production_approval_status": "not_granted",
  "blocked_reason": "preflight_not_completed"
}
